{
  "$schema": "https://json-schema.org/draft/2020-12/schema",
  "$id": "https://example.local/bob-bazaar-review/review-result.schema.json",
  "title": "Project Rule Review Result",
  "type": "object",
  "required": ["review_id", "vcs", "checklist_results", "findings", "summary"],
  "additionalProperties": false,
  "properties": {
    "review_id": { "type": "string", "minLength": 1 },
    "vcs": {
      "type": "object",
      "required": ["type"],
      "additionalProperties": true,
      "properties": {
        "type": { "type": "string" },
        "repository": { "type": "string" },
        "revision_mode": { "type": "string" },
        "revision": { "type": "string" },
        "base_revision": { "type": "string" },
        "target_revision": { "type": "string" }
      }
    },
    "checklist_results": {
      "type": "array",
      "items": { "$ref": "#/$defs/checklistResult" }
    },
    "findings": {
      "type": "array",
      "items": { "$ref": "#/$defs/finding" }
    },
    "summary": {
      "type": "object",
      "required": ["pass", "fail", "unknown", "not_applicable", "blocked"],
      "additionalProperties": false,
      "properties": {
        "pass": { "type": "integer", "minimum": 0 },
        "fail": { "type": "integer", "minimum": 0 },
        "unknown": { "type": "integer", "minimum": 0 },
        "not_applicable": { "type": "integer", "minimum": 0 },
        "blocked": { "type": "integer", "minimum": 0 }
      }
    }
  },
  "$defs": {
    "evidence": {
      "type": "object",
      "required": ["summary"],
      "additionalProperties": false,
      "properties": {
        "file": { "type": "string" },
        "start_line": { "type": "integer", "minimum": 1 },
        "end_line": { "type": "integer", "minimum": 1 },
        "summary": { "type": "string", "minLength": 1 }
      }
    },
    "checklistResult": {
      "type": "object",
      "required": ["rule_id", "title", "status", "severity", "confidence", "evidence", "reason"],
      "additionalProperties": false,
      "properties": {
        "rule_id": { "type": "string", "minLength": 1 },
        "title": { "type": "string", "minLength": 1 },
        "status": { "enum": ["pass", "fail", "unknown", "not_applicable", "blocked"] },
        "severity": { "enum": ["error", "warning", "info"] },
        "confidence": { "enum": ["high", "medium", "low"] },
        "evidence": { "type": "array", "items": { "$ref": "#/$defs/evidence" } },
        "reason": { "type": "string", "minLength": 1 },
        "suggested_action": { "type": "string" }
      }
    },
    "finding": {
      "type": "object",
      "required": ["id", "rule_id", "severity", "title", "description"],
      "additionalProperties": false,
      "properties": {
        "id": { "type": "string", "minLength": 1 },
        "rule_id": { "type": "string", "minLength": 1 },
        "severity": { "enum": ["error", "warning", "info"] },
        "file": { "type": "string" },
        "start_line": { "type": "integer", "minimum": 1 },
        "end_line": { "type": "integer", "minimum": 1 },
        "title": { "type": "string", "minLength": 1 },
        "description": { "type": "string", "minLength": 1 },
        "suggested_fix": { "type": "string" }
      }
    }
  }
}
